{
  "$schema": "../../schema/module.schema.json",
  "manifestVersion": 1,
  "id": "pdf-compress",
  "name": "PDF 용량 줄이기",
  "description": "여러 PDF의 글자와 문서 구조를 유지하며 바로 압축해 새 폴더에 저장해요.",
  "version": "0.1.1",
  "category": "document",
  "icon": "icon.svg",
  "entry": "index.html",
  "authors": [
    {
      "name": "rochelobeJYJ",
      "github": "rochelobeJYJ"
    }
  ],
  "requires": {
    "storage": "^1.0.0",
    "fs": "^1.1.0"
  },
  "optional": {}
}
