{
  "$schema": "../../schema/module.schema.json",
  "manifestVersion": 1,
  "id": "meeting-note",
  "name": "회의록",
  "description": "화자를 전환하며 회의를 기록하고 비공개 메모를 뺀 텍스트를 확인해요.",
  "version": "0.5.3",
  "category": "document",
  "icon": "icon.svg",
  "entry": "index.html",
  "authors": [
    {
      "name": "rochelobeJYJ"
    }
  ],
  "requires": {
    "storage": "^1.0",
    "fs": "^1.1"
  },
  "optional": {
    "clipboard": "^1.0"
  },
  "ui": {
    "keepAlive": true
  }
}
