{
  "$schema": "../../schema/module.schema.json",
  "manifestVersion": 1,
  "id": "pdf-mask",
  "name": "개인정보 지우기",
  "description": "PDF의 개인정보 후보를 확인하고 실제 정보를 제거한 새 문서를 만들어요.",
  "version": "0.2.1",
  "category": "document",
  "icon": "icon.svg",
  "entry": "index.html",
  "authors": [
    {
      "name": "rochelobeJYJ",
      "github": "rochelobeJYJ"
    }
  ],
  "requires": {
    "fs": "^1.1.0"
  },
  "optional": {}
}
