{
  "$schema": "../../schema/module.schema.json",
  "manifestVersion": 1,
  "id": "image-crop",
  "name": "이미지 자르기",
  "description": "사진에서 영역을 직접 골라 자르고 회전·반전한 이미지를 새 파일로 저장해요.",
  "version": "0.3.1",
  "category": "image",
  "icon": "icon.svg",
  "entry": "index.html",
  "authors": [
    {
      "name": "rochelobeJYJ"
    }
  ],
  "requires": {
    "fs": "^1.4.0"
  },
  "optional": {}
}
