{
  "$schema": "../../schema/module.schema.json",
  "manifestVersion": 1,
  "id": "duty-planner",
  "name": "지도일배정기",
  "description": "교사별 고정·제외 조건과 과거 횟수를 반영해 월별 지도일을 균등하게 배정해요.",
  "version": "0.5.1",
  "category": "classroom",
  "icon": "icon.svg",
  "entry": "index.html",
  "authors": [
    {
      "name": "rochelobeJYJ"
    }
  ],
  "requires": {
    "storage": "^1.0",
    "fs": "^1.1.0"
  },
  "optional": {}
}
