{
  "$schema": "../../schema/module.schema.json",
  "manifestVersion": 1,
  "id": "image-compress",
  "name": "이미지 용량 줄이기",
  "description": "여러 이미지의 크기와 용량을 줄여 원본과 같은 폴더에 새 파일로 저장해요.",
  "version": "0.3.1",
  "category": "image",
  "icon": "icon.svg",
  "entry": "index.html",
  "authors": [
    {
      "name": "rochelobeJYJ",
      "github": "rochelobeJYJ"
    }
  ],
  "requires": {
    "fs": "^1.4.0",
    "storage": "^1.0"
  },
  "optional": {}
}
